Title,Author,Date,Number of Responses,Content
I'm a Fax machine!?,NotTooLate,2020-04-06T11:51:04+0100,0,"I remember, not too long ago, or maybe it was, when I had a Fax machine. Well to be correct, it was an App.


Apps, this is one of those newish terms we use now without thinking about. I’m 65, so I grew up in the explosion of new technology and wanted to learn everything there was to learn, from programming and the computer programs that were being produced to do all these amazing things like… well I’ll leave that bit for you to decide, but these were called programs. Then someone, up there with the Gods, just below the big God, decided programming doesn’t really sound that good, more like brainwashing, sort of. It was decided that something nicer, friendly, applicable… ‘Application sounds nice,’ said, Geoffrey. ‘Oh No! said, Zippy, ‘Much too long!’ he responded in his usual intellectual and knowledgeable manner. Then Bungle piped up, using his two brain cells to fire a debate worthy of an Oxford debating society meeting. ‘Errr… App…. and before the full word could be expressed, the reply from, Geoffrey and Zippy, in unison, ‘App!’ ‘Perfect!’ Bungle, just look bemused and nodded! And all was good and everybody was happy again!


I know, I’m wondering again!


So, back to my Fax machine, or to be correct, my Fax App. I learned everything about it and I think I could do it all! The company had done a fantastic job of self promoting it. Why their program, sorry App, was not running the country, no the World, I just don’t know!? I now knew how to fax and had sent loads to myself. You can always tell a good app, because a good app lets you spend more time playing with yourself, than ever playing with anyone else. As everyone knows, this is possibly the main maxim of life… maybe?


Now, Days, weeks and months went by and my fax app gathered dust. Well it didn’t because it’s a program inside the computer, but metaphorically speaking, it was gathering dust. Does that make sense? Finally, I set the little fax icon on the screen free and deleted the app. I ended up creating a Folder called, Fax… added the program, sorry again, App, then burned it to a disc! Now there is something else I could rabbit on about, burning and discs… maybe I should explain… or, maybe not! I couldn’t tell you where the Fax app is now, I think it is the large pile of other discs and files that are waiting for something!?


Then, out of the blue an email, from the Government, I think. It was asking about something and gave options to reply, email, text, letter and Fax! I was so excited! I know, it doesn’t take much these days. I tried to remember where it was. I hunted and trawled through hundreds, if not thousands of files and there is was, the Fax folder, containing, you guessed, the Fax App! This had only taken a few days of my life, but now I was to get the reward due to me for purchasing that invaluable app! All that effort would now prove it’s worth. I reinstalled it!


‘This software is no longer supported by your computer’s Operating System! Please update?’ Not a problem, so I did. ‘Sorry, there are no new updates, or support for this version!’ ‘Please try our latest, World beating App, as verified by a group I had never heard of, and for today only, you can get it at a super low price, for the prime, starter package!’ Tempting, but I decided against it!


If I could have faxed them, I would have, but I decided to email and complain instead. No reply!


So, why am I going on about this outdated, none supported and useless Fax App? Well I realised that I am not alone and there must be millions with the same Fax app as me, but at the same time just as many with Fax apps by other companies too. While some of the better known, are still supported and have some limited connection, most, like mine are obsolete and long forgotten.


I then realised that this is so like dementia. There are millions of us throughout the World with our own copy of dementia, but while there is support and some connection for the more well known, like Alzheimer’s, lewy body dementia, vascular dementia and frontotemportal dementia, for the majority, there is none. While there is always this, the new and latest world beating research that has, just around the corner, the best new update ever, nothing yet! You see it is only the brand names that get the recognition, funding and support. If your particular type of dementia, doesn’t quite fit, then today’s Social Operating System, does not support it! We are alone and unconnected. I’ve heard over and over, of people with non specified, mixed, or what ever else they call it, dementia, that does not fit the particular requirements of the exclusive dementia club scene, finding that after six months, their so called support seems to dwindle and finally disappear.


Although for us, our copy, or type of dementia, is fully operational, reinstalled and updated daily, it has no real Social, or group support. We will remain as lost files, in forgotten folders.


We know that only the well known get the funding, and support, and we are told that there will be possible updates that may benefit the rest of us too. I’m so grateful, I will just sit here and wait!


Billions have been, and continue to be spent, without any treatments forth coming. If this is what is happening for the known dementia sufferers, what hope is there for the rest of us?


I no longer will accept being patronised with fleeting words, or scraps of maybe in the future, or someday!


I, as with all the other dementia sufferers, have fully functioning dementia today and our needs, need to be addressed by today’s Social Operating System. There are millions of us now and there will be many more tomorrow, if we don’t address this problem!


We are not demented fax machines!

My Blog"
It's a Grim Picture!,NotTooLate,2020-04-06T11:36:35+0100,0,"1 in 7 People With Alzheimer’s Lives Alone
New Report Paints Grim Picture
From the WebMD Archives

March 8, 2012 — One in seven people with Alzheimer’s disease lives alone.

This is one of the more stark findings from the 2012 Alzheimer’s Disease Facts and Figures, an annual report released by the Alzheimer’s Association.

I could not find any later report from the Alzheimer’s Association on the facts and figures.

The new report also looks at the costs of caring for people with Alzheimer’s and other types of dementia. In 2012, this cost will reach $200 billion.

According to the report, about 800,000 people with Alzheimer’s live alone, and as many as 50% of them don’t have an appointed caregiver.

This can happen for many reasons. “People become isolated, lose a spouse, or may choose to live alone in later life,” says William Thies, PhD. He is the chief medical and scientific officer for the Alzheimer’s Association.
		
Click to expand...



Firstly… this is no longer a, New Report. It is eight years old and we can say with certainty that the figures have increased!



I have found figures from a report by the, London School of Economics and Political Science.



Projections of older people with dementia and costs of dementia care in the UK 2019-2040








Let me clarify some points here… this report looks at people with dementia between the ages of 65 and over, in increments; 65-74, 75-84, 85+ You will not be surprised that as we get older, the rates of dementia increases.



It does not specify what is meant by Mild and Moderate, but it does use community care and care home services in its modelling, so I assume this must relate to those suffering with the severe forms of dementia.



If we look at 2020, the report says that 128,400 people will have mild symptoms of dementia and that is in the UK. How many would this equate too worldwide?



What happens to these people with mild dementia?



Do they go on to get Moderate and then Severe Dementia?
How long is this decline, if it is inevitable?
How many do live alone?
How many go on and live with their dementia without it progressing?
How many go on and change their dementia, by actions they take in their lives?


There is a massive and major mismatch between, the care, treatment and support given to mild and moderate sufferers of dementia and those that have severe dementia. It is predominantly towards support for those with Severe Dementia, because direct care is need for this group to survive.



For the Mild and Moderate group of dementia sufferers, there isn’t anything available to help. There is no medical treatment. This group is mainly coping to live alone. They may need some support and care, which comes from family and loved ones, but many will be coping totally alone.



If support was given, then maybe many symptoms of dementia could be slowed, stopped, or even reversed. What I have learned since my diagnosis, is that research seems to suggest this is true.


What a massive financial saving could be made, but more importantly, what a incredible difference to peoples’ lives. No longer this assumption that dementia is a one way ticket to a very lonely and frightening road to death, but something that can be treated and recovered from. I think the figures show, there are enough people suffering mild and moderate symptoms of dementia, that it has to be given a chance!



I am trying to reach out to others like me that are in that group that has hope.



I want to know how many of us there are out there and how many would like the chance to share ideas, thoughts, findings, suggestions and help build a support for those that have mild and moderate symptoms now, plus for those that will someday, the figures show, will be seeing the signs.



How do I start a campaign, how do I promote this idea, who can help?

My Blog"
Well something's Working!,NotTooLate,2020-04-06T11:33:19+0100,0,"I’ve only been blogging for a short time and my main aim was to find others like me and as something to give my brain to work on.

Great news… Blogging is doing it! When I first started, my spelling was so bad, the grammar was no better and it was taking me forever to draft, redraft and check one last time before posting out there. I have a few close friends that check and it was embarrassing having the post come back with still so many errors. Now, my spelling is improving, of course the spell checker is helping, the grammar is improving a bit too and it’s not taking me so long. I seem to be able to go along with a thread in my head… that sounds like quite a good catch phrase! The best bit, the errors are not appearing nearly as so often. They’re still there, but I tell them I put them in deliberately, just to keep them on their toes.

This must mean that my brain is developing, adapting and improving, so it must be keeping me away for that dreaded edge of doom.

So, have a go! Maybe you don’t want to do a blog, but what about a story for the kids, an article for your local paper, a poem, a song, or even a real old fashioned letter to a friend?

It works, it helps and keeps you going!

Please give it a try!

My Blog"
Cat Joke,Countryboy,2020-04-06T09:39:15+0100,0,"Lenny went on vacation and asked Bobby to watch over his house. About a week later, Lenny calls home and asked 
""How's my cat?""

Bobby hesitated and sadly told Lenny his cat died.

""What?! You shouldn't have broken the news to me like that! You should have done it slowly. The first time I called, you should have told me she was on the roof. The second time I called, you should have said there was no way to get her down. The third time I called, you should have told me that you tried to get her off the roof, but she fell down and died,"" explained Lenny.

Bobby apologized and went about his day.

About a week later, Lenny called again and asked ""How's my Granny?""

There was a long silence and then Bobby replied. ""Well, she's on the roof."""
POSSIBLE MILD DEMENTIA ASSESSMENT,stevew,2020-04-05T04:23:11+0100,0,"My GP referred me to memory clinic but they wish to conduct a telephone assessment. Due to family being present, difficulty concentrating etc this would be hard. Any thoughts please"
Try this,JIM rom Deeside,2020-04-04T11:04:59+0100,0,"When I was told by my GP he didn't know about Dementia and shown the door, and after a couple of months I was talking to a friend about it and he said that i should persevere by continually asking for a referral to a clinic so I started ringing 2 or 3 times a week it went against the grain but it worked after about 4 months I got a letter from the memory service with an appointment and that started the ball rolling. This might just work if your having trouble getting passed your surgery but also get in contact with the Alzheimer's Society they can help in all sorts of ways."
All my post have gone!?,NotTooLate,2020-04-01T16:29:35+0100,0,"Can anyone please tell me what has happened to my post? If you do not wish me to be on this forum, then that is not a problem, but please don’t just remove my post without letting me know!?"
Planning for the future,HarrietD,2020-03-11T12:02:43+0000,0,"NB: This post is about advance care planning, which is about making decisions about your future care and making clear your wishes at the end of your life.  If you're not in a place where you feel comfortable reading about this, please feel free to click away from this post. 

Hi everyone,

We've had the below request from Su Burns, the Associate Dementia Trainer for Alzheimer's Society's Training and Consultancy team.

She is currently writing a course on advanced care planning, and would love to have the views of people living with dementia (i.e. what is important to you when considering your future plans) to make sure the course content is authentic and representative of real people's views.

These would be used as case studies, and would be completely anonymous.

The course is due to be delivered in April, so the deadline is the end of this month.

Please take a look at the questions below, and answer as many as you're able to. You can also PM me instead if you'd prefer.

***

Questions:

Have you thought what your future wishes might be?


Have you talked these through with anyone? This could be family, friends or an independent person.


What would make it easier for you plan your future?


If you have discussed it with someone, what helped? What didn’t help?


If someone else started the conversation with you, was there anything they did to help you to make the right choices for you? What could have been done better?


Have you found any particular information useful? This could be something online, leaflets, publications or face to face.


If you haven’t discussed your future with anyone, what would help you to do this?


Have you been offered this conversation?


Who would you want to support you?"
left alone,angie999,2020-03-27T08:18:46+0000,0,"i was diagnosed in october 2019 and i feel i have just been left to get on with it .no one has been in touch with me about it i went to the doctors,i was told to get on with it  theres nothing they can do a mental health nurse as just made an appointment to see me next month should i have been told like this and just left"
Look for those with Dementia!,NotTooLate,2020-03-16T14:37:46+0000,0,"I have set up a blog to share my knowledge, experiences and what I am doing to slow, stop and reverse my Dementia, but I need help. There are lots of people out there helping, but it is those with Dementia, in all its forms, that I am looking for.
 
I am 65 and I have seen the rise of the internet, so I believe there must be loads of others out there,  that are like me, spending time online. If you are reading this, then please visit me at: 
 





						WordPress.com
					






					toolate.blog
				



 
I’m sure you will find something that is of interest to you, but of more importantly to me, you may have some answers, ideas and comments to my questions? 
 
I hope there are others out there... otherwise I'm in a very lonely place!"
"I completed a survey for dementia sufferers, did you?",NotTooLate2,2020-03-17T19:37:16+0000,0,"I ‘m sure I have just completed a survey for people that are suffering with symptoms of dementia, but I am not sure where, or if I did!?
Was it here, or does anyone know where it was? Have you completed this survey?

I’m trying to get in touch other sufferers in my quest to slow, stop and reverse the symptoms of dementia.

You can find me here: toolate.blog"
My Finn has Gone! ?,NotTooLate,2020-03-16T14:22:16+0000,0,"WordPress.com
					






					toolate.blog"
SO MANY MORE JUST LIKE YOU,Norrms,2020-03-04T09:37:16+0000,0,"SO MANY MORE JUST LIKE YOU



To see the tiredness in their eyes

And listen to their night time cries,

Is so very hard for some to do,

For the likes of me and you,







Dementias curse comes around,

Envelopes all, without a sound,

Yet anguished cries soon appear,

Along with temper and the tears,







You ask yourself so many times?

Have we committed such a crime?,

To bring this to our loving door,

And be cursed like this forevermore







Please take heart, you're not alone

Sitting by that silent phone,

Many more are just like you,

Bewildered, puzzled at what to do.



Please reach out, ask around,

So much info does abound,

So many people just like you

Asking all, what do I do?





Cc Norrms Mc Namara Diagnosed with Lewy Body’s"
I Too Have Demencia,One Moment At A Time,2020-03-06T04:24:19+0000,0,"Respectful greetings from Puerto Rico. Today emotionally I don't feel ""to very good looking"". But I must have an attitude of thanks giving to the Higher Power of my understanding for beening alive ""today & now"", my loved ones, friends, AD & AA fellowship meetings with wonderful folks and my Healthcare providers.

""What doesn't kills me"" makes me have more faith and feel stronger.

Sincerely wishing you innercalmness & lots... of blessings.

""Buenas noches"" ---> baby steps / easy does it / one moment at a time.

I'll have a nice hot cup of tea with my medication prior going to bed, be safe & take care."
Free prescriptions?,PJ,2019-10-02T17:48:55+0100,0,I’ve been told if you have a dementia diagnosis you are entitled to free prescriptions? Does anyone know if this is correct as we currently pay 10.40£ per month for mine.  Thanks in advance.
song for 2020,Norrms,2020-03-03T15:23:48+0000,0,"WITH WRAD 2020 in Mind 28th March 2020

WORLD ROCKS AGAINST DEMENTIA  5TH YEAR 


""A few of you have asked for the words to the song  the incredible singer Jennifer Boltons sang ""The Angel will Listen "" which is right here on you tube, which is the song i wrote,  sang by jennifer and music by John, here is also a message from jennifer regarding a new version of the song xxxxxxxxx




Norm Mac I have posted this on your timeline sweetheart.
Apologies for the delay in getting these done for you Norrms but here at last are the lyrics for TAWL that you asked for. We will send you the new 2020 version once finished ... nearly done! I’m sure you’re going to love it.
Jen xxx ♥️
The Angels Will Listen ???
(Verse 1)
When no one is around
To take you by the hand
And all that you can see
Is a dim and distant land
Looking forward sometimes
Is very hard to do
When everything becomes
Far too much for you
(Bridge)
There’s no need for anyone to sit alone and cry all night
Tell the whole wide world they’re welcome
And there is a guiding light
(Chorus)
Here at the purple angel
We will understand
So let us take your hand
Here at the purple angel
We will find a way
To help you through the day
(Verse 2)
The weight that you will carry
Deep within your mind
Is so very cruel
For those who are so kind
Even though dementia demons
Have come your way to stay
We will guide you through
Standing side by side
With you
(Bridge)
There’s no need for anyone to sit alone and cry all night
Tell the whole wide world they’re welcome
And there is a guiding light
(Chorus)
Here at the purple angel
We will understand
So let us take your hand
Here at the purple angel
We will find a way
To help you through the day
(Middle Eight)
Oh life is for living
Caring sharing and giving
So open your heart
Embrace who you are
(The angels will listen)
Oh we’re not worlds apart
No we’re not worlds apart
(Chorus)
Here at the purple angel
We will understand
So let us take your hand
Here at the purple angel
We will find a way
To help you through the day
Here at the purple angel
We will understand
So let us take your hand
Here at the purple angel
We will find a way
To help you through ?



Norrms McNamara


(C) Copyright """
SOUND FAMILIAR ??,Norrms,2020-02-23T16:51:30+0000,0,"SOUND FAMILIAR ???

Elaine : Come here and i will show you how to do it?

Me : It doesn't matter how many times you show me i wont remember, i wish i could!

Elaine : When we get there remind me we haven't got any washing powder left and need some
Me : Err, me remind you ??
Elaine: you have left the bathroom light on AGAIN !!
Me: i have dementia ! what am i supposed to do ?
And so it goes on, WHY ?? Because we are only Human. I know this won't be popular with some, but when i see the Do's and Don'ts lists of what to do when in the company of someone with dementia, do they REALLY think it happens like that in real life?? do they think that we are all THAT even tempered and have the patience of saints??
This applies to both those with dementia and carer`s alike. The list these people produce should be headed up as GUIDELINES only because with the best will in the world, when someone asks you the same question again and again it going to get on your nerves SIMPLE !!> I once wrote "" When i was first diagnosed, i thought the whole world was wrong and i was right as i kept getting told what i was doing or saying wasnt right !! Turns out the WHOLE WORLD was right and i was wrong!! But it took a diagnosis to realise this, and even then some dont believe it.
But i just wanted to assure all you incredible carers / carvivers / loved ones out there that it really is OK NOT TO BE OK and you WILL get frustrated and be short tempered, you are only HUMAN after all, and if anybody else tells you different they are LYING !!
The guilt monster who sits on your shoulder is the worst one of all, it will whisper in your ear you're not supposed to shout, get mad, get frustrated, please make sure you turn round and shout at it "" its ok for your, YOU'RE not the one going through this!!!
I hope this helps and always remember, you are angels that walk this earth and who have to look after the likes of us, for that we are eternally grateful
Norrms
Diagnosed with Lewy Bodys"
PLEASE DONT,Norrms,2020-01-22T15:19:07+0000,0,"""PLEASE DON`T""
""Mock "" my Dementia, i was once like you, i once worked full time to keep and provide for my family. I had so many hopes and dreams, i STILL DO !! You don't even know me, you have no idea what i have achieved in the past and what i hope to still achieve now, please don't mock me just for being ill, i wouldn't if roles where reversed, you don't even know me, please dont mock me just because i have dementia.
PLEASE DON`T
"" Stare at me, let`s stare together at the changes that are now being made within the world of dementia, let us stare together in wonderment at how the stigma of this disease is being disassembled before our very eyes, brick by brick the wall of Stigma is coming down.
PLEASE DON`T
""Ignore Me"" i have so much to say, i have early stages of dementia, have you even heard of that? Dementia doesn't just suddenly ""Happen"" it creeps up on you slowly, in stages, but if you LISTEN to me i can help you recognize the signs of early dementia so you can help your loved ones to carry on living a full life.
PLEASE DON`T
""Tell THAT Joke"" about dementia, i have heard them all, and they are not funny!! When you forget something, why do you think it's funny to say ""Ha ha, i must have dementia"" If you got a pain in the back or abdomen would you say ""Ha ha, i think i may have Cancer ??? i think not!!! Dementia is a terminal disease with no cure at thew moment, nothing much funny about that!!
PLEASE DON'T
""Write us off "" We have so much to give, so much to do, so many more people to meet, to laugh with, to love, to cherish. So many more grandchildren to see born and to teach the ways of the world, I am not finished, in fact i am just beginning to see life for what it really is, short, but beautiful, and so can you, if only you embrace it fully.
I am me, i am Norrms, Just a boy from Bolton who has been diagnosed with the awful disease of dementia, please see me and not my disease xxxxxxxxxxxxxxxxxxx
CC Norrms Mc Namara Diagnosed with Dementia
Please share, please copy, please print off and please put up in workplaces etc"
EVERYTHING YOIU WANTED TO KNOW ABOUT DEMENTIA ??,Norrms,2020-02-19T15:28:26+0000,0,"Everything you wanted to know about Dementia, but were too afraid to ask, probably ........









						Norman Mc Namara
					






					www.youtube.com
				




Over the years i have touched on many subjects regarding dementia like End of life, moving house, denial etc  and happy to say quite a few are now used for training staff all over the world, so i hope these will help you all, no matter who you are or where you are, understand dementia a little better, so please use, please watch if you want to, you can pick and choose which one`s and none are very long, please leave a comment on You Tube,and by the way there are a couple of humorous recordings, non dementia  ones, i have left in as well
best wishes

Norrms xx









						Norman Mc Namara
					






					www.youtube.com"
