Title,Author,Date,Number of Responses,Content
We are not so different after all....,Norrms,2018-02-20T09:08:12+0000,0,"We are Not so very different after all?


I used to be just like you, honestly!
I worked hard, laughed and cried, loved and lost,
I brought children up just like you do now,
My school days were happy,
My childhood filled with Laughter,
Ask me! and I will tell you all,
My teenage years? yes they were different to yours
But no so very different as you may think,
I was also shouted at, loved, scolded and sent to bed early,
Our fashions were different,
But so many things we wore then, you are wearing now!
So very funny,
Our music was definitely different,
But that doesn't mean I don't love today's music,
Ask me, you would be very surprised!
So what changed?
I got old, that's what!
I also become a little forgetful,
But not as much as you think
So come on, ask me what happened when I was a teenager,
Who my first love was,
The names of my children,
You see, we are not THAT different at all, are WE??
Just because I can't remember yesterday,
Doesn't mean I have so many memories to share with you
You only have to ask ??????


Cc Norrms Mc Namara Diagnosed with dementia
Please feel free to share xxxxxxxx"
ROYAL SUPPORT FOR WRAD 2018,Norrms,2018-02-25T09:58:22+0000,0,"ROYAL FAMILY NEWS RE WRAD
""WORLD rocks against dementia""
A message to you all from His Royal Highness Prince Edward UK saying thank you for all you are doing to help WRAD be a success this year, YOU should ALL be so very proud xxxxxxxxxxxxxxx

To find out how you can hold an event this year please contact me"
Joke,Countryboy,2018-02-24T15:28:37+0000,0,Hi Guys can someone tell me where the ******* joke section is on the site
Read of the reality when I’m Sundowning,Barry,2013-02-18T00:21:52+0000,0,"“How Sundowning affects me”​
Some time ago on Talking Point I was asked the following question and I quote:

(Barry could you explain how you feel whilst Sundowning, does anything trigger it or does it just happen like clockwork?) 

Well as there are now so many ‘New Members’ I thought it might be a good idea to post the thread again for easier reading rather than searching as sometimes new comers want answers immediately…  


The easy answer would have been to just to say yes (It happens like clockwork) but I think the subject is far more complex than that as it seems that Sundowning as it’s called can affect people with our illness at different times of the day, “in fact” a similar thing can also happen at the beginning of the day when the sun is rising, although the latter part of the day when the sun is setting seems to be the most significant time...

One thing I should explain is that here in Indonesia and some other parts of ‘Asia Sun Rise and Sunset’ occurs at about the same time everyday of the year, by 6am its broad daylight and by 6pm it’s getting dark unlike European countries when during the summer you have extended hours of sunlight from 4am-9pm which in itself could have some significance as to when a person starts to feel the effects of Sundowning?

But how does it make me feel: I think the best way I could describe it is to say that it causes a similar feeling that I can still remember after having had a nervous breakdown some years ago that at the time resulted in extremely deep depression.

For me it normally starts at around 3-4pm when I start to feel very lethargic and just seem to be wandering around the house utterly lost in my own world mumbling to myself or sitting in a chair drifting into daydreams (in fact my dear wife Sumi says she can now tell what time of day it is without looking at the clock) I fell as though the end of day is trying to drain every last bit of energy out of my body, all my limbs become extremely weak and I find it very difficult even to go for our walk but still go in a effort to ward off the Sundowning effect, I can become incredibly short tempered and loose all sense of rationality and sometimes become verbally aggressive and argumentative, you feel as though the whole world is against you and that whatever you say or do is wrong so I don’t like to be posed any questions at this time of day not even (what do you want for dinner) and I certainly don’t like to have any visitors at this time not unless they want their heads bitten off as my mind is at a total loss of any comprehension, all I want is to have my dear wife by my side but she now realizes that it’s best to talk to me very soothingly and I’m sure that she now just agrees with everything I say in an effort to keep me calm and also makes sure the house is kept peaceful without any excessive noise to further confuse my mind (Bless her as she has so much patients with me) as I start to feel as though I have the whole weight of the world’s problems upon my shoulders and everything becomes a effort so much so that my wife now has to help me bathe and get dressed as I’m so agitated and shaky...

So there is nothing that actually triggers the Sundowning apart from the setting of the sun as it descends towards the horizon which makes it feel as though its automatically starting by itself, but if it’s not handled with sensitivity then there could be untoward repercussions, also I should add that not everyday is the same as some can be worse than others and sometimes I can go for a few days without feeling any effects of Sundowning and the other strange thing is that even the weather conditions at the end of day can have some influence if its overcast I feel much better and responsive but if it’s a strong bright crimson sunset that we get out here then the draining affect starts much quicker, in fact, I get much the same affect when I go into a shop that has to brighter a neon, or flashing lighting...

“Now read of the reality when I’m Sundowning”​
This is written on actuality not supposition from when my dear wife Sumi and I went for our end of day walk it’s not just a one off situation or sensation for me it’s more of an occurrence day after day that totally shatters me!         

It was just 4-30pm as the sun starts descending over the horizon when lethargy takes a grasp of me and the Sundowning affect ‘tolls the knell of my end of day’ so I’m writing this down trying to express the depths of my ‘true inner feelings’ at that exact moment in time...
My whole body aches as the muscles try to maintain some equilibrium, and as we go for our walk every faltering step I take being like that of wearing shoes made from concrete that’s slowly setting and intensifying in weight, which makes me weigh heavily on my walking stick and Sumi’s arm otherwise I feel I could just pass out from utter exhaustion as my mind is consumed in a dense obscure cloud of disorientation and bewilderment, my limbs are trembling so much I don’t know what to do with them to ease the tremor… my vision has become blurred as my eyes feel heavy wanting to sleep and escape from the sun’s setting draining sensation, so Sumi tries talking to me to take my mind of the horizon as my eyes have become mesmerized following the sun’s descent and harsh rays… but I can’t comprehend what she’s saying, I try to reply but any form of words and speech are held tight within me so all I do is mumble something incoherent which then makes me frustrated and I become really irritated and tetchy with her, the slightest little noise is more like thunderbolts slamming into my ears and making me very anxious and extremely jumpy...
The further the sun sinks away… the further I go into despair of doom and gloom… and sometimes it gets me to the point of saying to Sumi: (I’ve had enough of this, maybe it would be better if it all ended now, and I did not wake up again) as I can almost sense death waiting round the corner taunting me when in this daily living hell of Sundowning, I can see the tears glistening and running down her cheeks as she holds on more tightly to me saying ‘please don’t speak like that’ but I seem to be oblivious to her own anguish as my whole being is so distraught by the time of day that I just want it to come to an end... 
As I said those where my exact feelings made from notes one evening, but as I type them out the next morning I had little recollection of that moment in time… it’s as if it never existed… as this morning I feel a completely different person still full of determination and the spirit of fighting this terrible illness, but when Sundowning strikes it takes us into a completely different world of anxiety within dementia...
I will be very interested to know what others people’s observations are with Sundowning as it’s another part of the illness that doesn’t affect us all in the same way.

Please feel free to copy this to your friends or on your own Blog sites as it might help other people to better understand how Sundowning can affect a person who has any type of dementia...

Barry"
direct funding and pip,ossie10,2018-01-24T12:26:00+0000,0,"I did not know where to post this(as ossie 10 my father is to rough to post at present)
I was wondering if anyone could tell me,through dads mental health team dad got a direct funding grant, for someone to come round and do his breakfast and lunch(while I am at work) also to try and get him out in the community again, will this effect his PIP claim? as I don't want to get him into trouble.

As dad would say love to you all and thanks for any help/guidence"
memory test,kazb,2017-07-19T13:23:49+0100,0,"Hi kind helpful people.
So i was a nurse and got diagnosed 2year with altzheimers,had a PET scan and said i had dementia.
Work finished me , i have now learned to try and live with it.
Hubby left me and son came to live with me and sold his house.
I have yearly memory tests, had appointment last week. Received letter today to say i performed better in this test compared to when last seen.
On most of these test as she wanted a answer i just guessed.
The consultant said it would be helpful to repeat the brain scan.

Do you think this is normal as i always thought it got worse not better. ??
Do you think i may have been misdiagnosed ??
What is he expecting the scan to show ??,is it normal to have another scan.
Sorry for so many questions, but my life nearly ended with this diagnoses and i have lost my career,hubby and much more."
Purple Angel memory cafes How do they work ??,Norrms,2018-02-11T11:39:33+0000,0,"HOW PURPLE ANGEL MEMORY CAFE IS RUN (for reference, please feel free to copy but most of all HAVE FUN !!)

Volunteers for the cafe? , no need for professionals but always helpful if you have one or two, otherwise better to have those who have worked as carers, are carers or have some connection with dementia
The two words we cherish most is INCLUSION and ENGAGEMENT so with that said a MUST is to have a volunteer on EACH TABLE at all times (Apart from when serving tea and coffee) This inclusion with them, chatting to them, reassuring them and answering their questions is so very important to make them feel comfortable

ALWAYS REMEMBER ITS THEIR CAFE !! NOT YOURS, you are just the facilitators (ask all every four weeks what THEY would like to do at cafe)

TIMES of cafe ""EVERY WEEK""

,( once a month for people with dementia to remember is far too long, )

On Entrance meet, greet, take names of both PWD and carers (Health and safety must be a priority)

1.30pm till 3.30pm (Music must be playing in background all the time, 50s and 60s please and keep the war songs for remembrance day
1. Tables are set out like a cafe and NEVER like a care home all in a circle.
2. Tables are dressed with cloths, dried flowers, Biscuits, books from yesteryear, magazines etc, gives them something to do whilst waiting to start
3. A 20 Question single answer quiz is placed on each table (1 between two people) so they can do this as well and answers are given out at near end of cafe
(We once forgot to do this and we were nearly lynched lol )
4. On arrival tea and coffee is given out (free)
Cafe opens at 1.30pm then this is our agenda which is written on a whiteboard for all to see so they know whats happening that day (Always day and date the whiteboard each week as well so all can see)
1.50pm Welcome all and any updates
2pm NINE LETTER WORD please see link
http://nineletterword.tompaton.com/amscagnip/
This is where you ask all those with dementia to shout out words of three letters or more made up from nine letters but they HAVE To have designated letter IE A in each word (Please see link)
Please be aware of carers, loved ones shouting for them, it happens more than you may think, we allow some to keep it flowing, but not all
2.15 Either, (just a few suggestions)
CRAFTS or
CAKE DECORATING or
GAMES DAY
IE Dominoes, Connect Four (Always popular we have five sets lol) old-fashioned wooden bagatelles, snakes and ladders puzzles to put together (but not jigsaws, take too long) ect
or
Team games of
Play your cards right, or
Balloon Tennis or
Ten items on a board,m try to remember as many as possible
or
Famous faces, picture quiz where they have to figure out who they are, TOP TIP< always good to throw an old photo in there of two members / Volunteers gets em every time lol
or
Aroma pots where they have to guess the different Aromas
Flower arranging (Contact local florists, usually accommodating)
2.45pm TEA COFFEE AND HOME MADE CAKES
3pm Answer to a table quiz
3.05 till 3.30om
A good old sing song with song sheets is a must, or you can ask local singers to come and do a TURN LOL
we always finish off with a sing-song as its proved to light up all the electrolights in the brain and sends them home happy.
3.30pm Always have someone stood at the door to say goodbye, wish them well and to say see you next week, so important.
My dear friends, i hope this helps and if anybody wants to know any more, please just ask and let's fill the world with PURPLE ANGEL MEMORY CAFES xxxxxxxxxxxxxxxx


FOOTNOTE 

You do not have to have a diagnosis of dementia to come, dont want to leave anybody out, especially those who are so worried about thier memory 

We are totally self-funded, and raise our own funds via tea dances, sponsored walks and donations on the door, we never ever charge for tea/coffee entertainment or Entrance"
To Tired To Be Tired,Norrms,2018-02-12T16:34:15+0000,0,"""I`m too tired to be tired ""

Just overheard a carer talking about looking after her husband and thought WOW this sentence really sums it all up.

THANK YOU ALL CARERS / CAREGIVERS for ALL YOU DO 
xxxxxxxxxxxxxxxxxxxxxxxxxxxxxxxx"
First song i wrote,Norrms,2018-02-10T14:27:19+0000,0,"First song i ever wrote about the purple Angel, sung so beautifully by one of staff at pendine park Wreham
Please enjoy and share"
Today,Norrms,2018-01-31T09:33:50+0000,0,""" What people said about you yesterday is irrelevant ""
"" Its what YOU DO TODAY that matters ""

Norrms"
Talking books,Jorbin,2018-02-06T12:29:55+0000,0,Hi. I am looking for talking books.
Weighte Blanket,danonwheels,2018-02-01T16:22:54+0000,0,"I'm getting a weighted blanket soon, can't wait!"
Psychosis?,danonwheels,2018-02-06T12:36:44+0000,0,"I've read a few bits and bobs that seem to suggest psychosis (hallucinations and delusions) are a part of Alzheimers for some people.  Just wondering how true this is?  I've been recently diagnosed with psychosis and my GP has referred me to the same people I'm under for my alzheimers but a different team, so it's like she's not linking the 2.

Does that make sense or would it be more appropriate to see the memory clinic perhaps?

Oh, my psychosis manifest itself as a little girl who seems to like hiding behind my living room door and appears to be trying to tell me something.  I also hear what sounds like people trying to get into my flat and that one can be scary but I have the insite to know it's not real for now."
Feeling so heavy and distant,NotTooLate,2018-01-18T11:07:26+0000,0,"I had a bit of turn and now feeling heavy . it is like i can feel the weight of my body. I feel distant in my head  and far away. I can close my eyes and be here all day. I feel drugged. When my son comes I know he will see some thing different. I will try and be normal. I realised that my carer only sees what I show him, or when I am acting different but not what is going on inside me. I do tell him but it is hard to make you understand what it is like really. 

I am feeling so heavy, so far away. I am trembling inside, cold and feel like I do not want to be here.

writing this is so hard physical and mentally. it is hard to do anything when I am like this but if I do not then know would ever jknow. 

I wonder if any body else that has dementia understands what I am saying?"
Not Yet Diagnosed,Gladys S,2017-12-06T22:28:08+0000,0,"hi there. ""sorry for the long message"". I have been to the doctors and referred to the memory clinic who have organised a ct scan. I have had about 10 different appointments for different bodies of the community regarding my well being. (I only went to the docs to say I am concerned about my memory. I am 63 years old and live with my husband who is a great support. The ct scan is next week then I have to wait for a further appointment to get the results. I have been keeping a diary of the ""daft"" pardon the expression, things I have been doing. I have had to stop driving after telling my doctor I was pulling in behind cars which were parked thinking they were at traffic lights further down the road. my husband was anxious by this time so I went to the optitions who have now referred me to the eye clinic because I have more double vision. so the doctor has said not to drive. that appointment is not till February 2018. another thing I did yesterday and similar a while ago was I was lighting the log fire with a fire lighter and could not work out how to hold it, I knew what to do to light it. ..........there are more things that have happened !!!.........I do have other medial problems, fibromyalgia and atrial fibrillation  which i have 50% chance of a stroke) and osteoarthritis and depression. I know they are looking to check if my meds are causing my symptoms but I know deep down the things I have been doing are new, the last 12 months when I have had tablets and medical symptoms for a number of years now. I know I am not reacting and doing things as I have done for years...............................I am worried they will find some kind of dementia, (I have read so much about the different ones). if they don't then its a blessing that I am clear of it and am more aware of this awful illness people, friends and families have to contend with. I know i will then have to work with the doctors to change my meds to help what is going on with me. if I am I feel sure they will tell me I am in early stages and that it is due to my illnesses and medication. ..............................I just wanted to share this with someone who understands how I may be feeling before the diagnosis. thank you for reading."
Concrete Overcoat (Depression),Norrms,2018-01-23T15:46:15+0000,0,"When the concrete overcoat arrives,
No matter how well you think you are doing or how well you think things are going when the concrete overcoat (Depression) as I call it arrives it gives no warning. The Closest I can explain is like someone putting a coat on for you extremely slowly and the coat weighs 800lbs at least!!
It drapes over your shoulders, creeping slowly, covering your arms until you have no energy to lift. Your neck feels weighed down, your back aches, you cannot stop looking at the floor as if someone is pushing you ever closer to the ground. Your breath is labored and you have absolutely no interest in anything. The intensity can differ as can the length it decides to stay with you.
I sometimes think "" As if I haven't enough to put up with""
I sometimes think
"" I have been ill for so very long now, how much longer dear GOD!! ""
But when It arrives, it arrives, from who knows where? The deepest crevice of your brain? Your inner fears? Or a brand new awful memory which has tipped you over the edge? No one knows, but believe me it's real, it's very real and when it leaves, only IT decodes, not you!!!
Does dementia also walk hand in hand with depression? Sadly, in my humble opinion yes. How can you sit there, be told you have a terminal disease, be told that the chances are you will forget your family, your loved ones and all you have ever known and NOT become depressed?
So Sad xxxxxxxxxxxxxxxxxx"
I can not stop crying!!!,NotTooLate,2018-01-23T12:05:41+0000,0,"I have never been what you would call a sensertive or showed my feelings, but now I can not hold back the tears. I think of my son or daugther and I well up and the pain inside is so much to bear. News and even adverts on telly send me in to floods of tears. I can not stop it. I am so desperate to see someone to talk about it. I feel so lost. The Birmingham Healthy Minds said could not help because I am being looked after by Juniper Centre in Birmingham. I will have to get my son to ask to see someone.

The tears and pain and just to much!!!"
I am me today,NotTooLate,2018-01-13T12:40:47+0000,0,"Today is a good day. I am me, the old me and I realise that there is tow of me. I seem to be going from a person I remember and know, to someone I do not.

On my good times I worry about the times that I am going to be bad. It is horrible as I hope so much that it has gone, but I so dread changing and becoming something I do not no.

When I am bad, or different I do not think I worry as much about it. It is strange. The bad days seem to be a mix of all sorts of things. Mainly not being in control of my day and life. Lots of empty spaces. I watch telly but miss a lot of it. seems like I am thinking of something else and then wake up and start watching again. but I am not alseep if you know what I mean. like day dreaming.

This is the days I get frustrated. Hard to keep going, thinking about what I am doing, what has happened. I am at a point were I am not sure if I have done it, or said it and this drives me angry with myself and often other. I just get frustrated. Some times my day goes by and I do not see it. This is not bad. I wonder if this time of being unaware will get to be my everyday!?  What is frustrating is do I no those times that I can not remember, or is it those times that I am as if I am asleep, like in a dream!?

On my good times I like to plan and think of what I am going to do next, tomorrow and look forward. My bad days, it is the other me just watching time go by without knowing it. 

I do not like this other me and do not want him to become the me everyday!

Does anyone else feel like this, like you are split between two people?"
Catheter,danonwheels,2018-01-18T14:37:20+0000,0,"I've been self-catheterising for about 10 years now but have asked my continence service about the possibility of having a supra-pubic catheter installed instead as I'm struggling with coordination and remembering how to catheterise properly.

Anyone else had or has similar?  Any idea what to expect at all?

Thanks"
I have dementia and no-one to talk to.,L3NWB,2017-12-05T14:07:10+0000,0,I have dementia and needs to talk to someone
My problem,Birdlady,2018-01-14T22:15:54+0000,0,Hi all I am new to this site and not sure what to do I was diagnosed with dementia about a year ago and am still trying to learn more about the condition but getting very frustrated as I keep forgetting what people are telling me and don't know what to do I am only 59 and so confused by it all and where to get help ty
Sundowning,Norrms,2018-01-18T10:37:54+0000,0,"DEMENTIA, SUNDOWNING RAW AND UNFORGIVING
I wish the darkness would never come,
I wish the day would stay forever light,
I sit and dread the time as it passes,
Sat in my chair I watch the clock,
Tick tock tick tock,
The evening creeps ever closer,
My mind becomes muddled and distant,
I feel myself slipping into the abyss of what?
Of madness ? of delirium? Who knows?
Will we ever know?????
I lose half of my days sometimes,
Hours and hours I cant remember,
And that I will never get back
All my evening memories GONE forever
How much is that out of my life?
It's now 4.29pm, how much longer?
How much longer before I forget,
Where I live, my wife
My family, what I had for lunch
DEAR GOD !! HOW MUCH LONGER ??
4.41pm, Still here, still sat in my chair,
Or Am I? Or do I imagine even this?
Some say it the environment I live in?
But I live at home, with my Angel,
She looks after me, all my family do
It's lovely where we live,
Apart from my dementia I am so happy
So how can it be?
So sorry, got to go, i think?   .........................................................

Norrms Mc Namara
Please share if you wish too xx"
Episode Four of telling the Truth About dementia,Norrms,2018-01-18T09:43:01+0000,0,"Hello, all this is the fourth episode, thank you so much for all your kind comments, much love, Norrms and family|"
Is it worth me learning something new?,NotTooLate,2018-01-13T12:47:23+0000,0,"Today is a good day and I want to do lots. I have lots of ideas. I would like to learn to make an app. I have been looking on Apple site and get keen. I think I coudl do this now, but it is that time when i not feeling up to it. 

I read book, The Alzheimer's Solution, a very good book, and this suggest that learning can help prolong problems and even stop it. This idea keeps me going!

I would like to no what others how have dementia think about learning new things. Do you enjoy it? Does it help? How do you cope on bad days, or do you not do it on them days? I think on my bad days I would just miss the day.. if that makes sense."
