Title,Author,Date,Number of Responses,Content
Your advice - Appointing an attorney,TamsinT,2024-06-05T15:16:36+0100,0,"Do you have any tips for other people with dementia about deciding who to appoint as an attorney through an LPA or similar legal document? 

Perhaps they’re wondering whether the people they have in mind will be able to agree with other, or they might be unsure about how to ask a friend or relative about being appointed as their attorney. 

Maybe they can’t think of anyone suitable at all. 

We’d love to share your advice with readers of our magazine, Dementia together – please email magazine@alzheimers.org.uk or add your tips below before 27 June."
Webinars delivered by people living with dementia,HarrietD,2024-01-11T12:11:28+0000,0,"Hi everyone,

We wanted to let you know that the brilliant 3 Nations Dementia Working Group regularly produce a series of webinars on all kinds of topics. They're all planned and delivered by people living with dementia.

You can access them here. They post recordings up fairly soon if you miss any.

They're usually chaired by Nigel Hullah, who was diagnosed with early onset dementia in 2013. 

We hope you find them helpful and inspiring"
Hints and Tips,Pejic,2022-08-18T18:17:16+0100,0,"Any chance of making this a sticky thread, we can post to with things which we think might help others fighting the fight?"
The dementia guide: for people dealing with a recent diagnosis,HarrietD,2021-05-05T13:30:02+0100,0,"Have you recently been diagnosed with dementia?

If so, The dementia guide: Living well after your diagnosis is written specifically for you. It has information about treatments, support and services available. It also has tips and advice on living as well as possible with dementia and planning for the future.

The latest edition of The dementia guide has new information on planning hospital stays, accessing care, your rights at work, and the different types of support services that are available to you. People with dementia and dementia professionals have been involved throughout the guide’s development.

There are many ways to access the guide. You can:

Read it online: https://www.alzheimers.org.uk/sites/default/files/2020-03/the_dementia_guide_872.pdf

Order a print copy: https://www.alzheimers.org.uk/form/order-dementia-guide

Get it in different languages, or audio and video formats: https://www.alzheimers.org.uk/publications-about-dementia/the-dementia-guide

If you have any feedback or questions about the guide, you can email publications@alzheimers.org.uk"
You guys sometimes goof up too?,MatthewB,2024-04-05T13:17:54+0100,0,Maybe just take some time to remember how to do this internet one? I'm goof up that put the headlight in my life wife car and was take too long is then make her late to do that appointment. Kind of sad when can't do so many thing I'm used to do always so good I'm feel like I'm not sure maybe useless the right word just take up space I don't want to be this way I don't know why I can't keep straight the way to do thing or remember where I am put my tools I probably shouldn't be saying all this stuff do you guys but I don't know it's just sad only word I can know to say sorry I don't want to bring other people down just get sad and the night time whenever everyone is sleeping and it's just me thinking anyway this is Matt hope is good with you guys God bless you this is Matt
I don’t know how to handle this,Nobo2,2024-06-13T22:41:06+0100,0,"Hi everyone, it’s been just over a year since I last posted about my wife not recognising me at times. So now we have progressed to the point where it can be all day , morning, evening, bits in between every permutation. That in itself is confusing because I do not know at any time who she is seeing me as `husband, Friend, another man. Somebody else impossible to know, so I just carry on as normal.
my biggest dilemma is at night when she doesn’t know who I am, for example she thinks I am the friend and I can go home anytime I don’t have to wait for her husband to arrive. However, what do I do I don’t have anywhere to go and I’ve no way of knowing what she will do if I try to persuade her that I am her husband. 
we live in a flat so it’s not possible to go into another room and reappear as Me husband.
Has anyone else had this if so any pointers on what to do. Please"
Incontinence issues,Sam50,2024-06-10T13:26:00+0100,0,"Hi everyone, I am a 50 yr old man with early onset dementia - diagnosed 2 years ago and am now having problems with bladder control. Started with just leaks, but more and more am finding I am losing control and seriously wetting myself. It is very embarrassing. I am alsp wetting my bed now. I have just bought some pull ups and hope that these will help. I thought this was going to happen later, not so soon. Is anyone else have this problem and do you have any advice? Feeling quite down. Thanks. Sam"
Getting used to dentures,Sam50,2024-06-11T11:36:00+0100,0,Hi it’s Sam. I had my last teeth out some time last yer and got dentures at too and bottom. I am still finding eating and talk difficult snd keeping lower one in. I prefer not wesring at home only when out. I am trying but as my dementia gets worse i am not sure i will want to wear them and i know will cause problems.  Not sure if anyone here has dentures and if they find problems. Any suggetion welcome.
Always tired,Sailor Tom,2024-04-06T18:37:22+0100,0,"Is anyone always tired. Ever since I have been living with dementia i feel like i have been tired.  I can have a good night's sleep but by mid day i have go back to bed and sleep for at least 2 hours,  sometimes 4 hours. 

Tom"
Diagnosis how did you deal with it?,vas,2024-02-02T18:42:41+0000,0,"Before Christmas after a scan to check on a presumed stroke I was told verbally by a visitor from the old folks mental heath office that I had Altzhiemers and vascular dementia. I had no consultant letter or face to face appointment. This year I was told I didn't have Altzhiemers. I asked for a letter with the diagnosis. Now this week during a telecon with the consultant I was informed I a had Altzhiemers together with vascular dementia. I was also told Altzhiemers could only be confirmed with a brain biopsy, which obviously, could only happen when the patient is dead.
It was a most unpleasant phone call.
I also found this afternoon my doctor had been informed of the disgnosis the information was shared with my husband without my permission. Its as if, because of the diagnosis, I am no longer a person with rights. No wonder sufferers can get angry.
I think the way both patients and carers are treated is disgraceful."
Early onset Dementia and Pacemaker replacement. I don’t want to do it.,bunnylovevol,2024-04-19T23:54:26+0100,0,"Hello, I am a 60-year-old female who has had a pacemaker for the past 15 years. I just got newly diagnosed with some form of dementia, my guess vascular. I live alone, I have no children, however, I do have older siblings, nieces, and nephews, etc. I was just given this diagnosis recently and also I’m at the point that I have to have my pacemaker battery changed out. I don’t want to do it! I don’t want to live the next 5 to 8 years with dementia, the drain on my family, and the medical system, and on myself. Has anyone else ever run into this situation with a young family member? I would rather live the last couple months of my life, happy and doing things I would like to do and let the pacemaker battery life run out. I’m not asking if whether I should do it or not, I’m just asking if anybody else has had family members go through this? How did you as a family emotionally handle it? How did the person affected with dementia in the early stages handle it? I have to let my doctor know soon. I was scheduled for the procedure before I found out about the new diagnosis of dementia.  

Thank you."
Dementia and Hobbies,KenC,2009-04-15T23:52:50+0100,0,"I find it amazing at times when I see people like myself with dementia who carry on with their hobbies and sometimes start new ones to see if they can master it. I also admire them for this.

Since being diagnosed I have started using a digital cameras which I carry with me on my walks, and it amazing how I have taken to it after using a Canon SLR film camera which had zoom and wide angle lens all in a bag. 

I had to stop using the film camera because I had problems loading the film at times, so the digital camera saves a lot of stress. When I get home I then load them onto my lap top, where I have my own photo album.

I also took up painting again after my diagnosis, and although this is just basic I get a lot of enjoyment from it once I can get started. 

I did start to go to classes, but I found that the teacher was not really interested in novices, and all he wanted to do was give everyone a copy of a certain picture and ask them to copy it. 

This worked well until my last day when he produced a copy of something resembling the ""Scream"", which looks rather frightening to start with. 

Apparently the original was done by someone who had some form of mental problem, but no one seems to know what it was. However after struggling through this piece of work for around half an hour, the teacher came back and took my picture away and started to show it off around the class, which I found a bit disturbing.

 What he then said was, this was one of the best copies he had ever seen which I found embarrassing. 

I did not dare to explain that I had dementia, as no one in the class knew at that time. 

Some time later a lady came up to me and asked why I had stopped going to this class, and I admitted that I had problems with art as I am just a novice. 

She then said that after being told that I had dementia from someone else, she wished that she has spoken to me and made me feel at home. 
She also said that the last piece of work I had done made everyone think that I had been an quite proficient as an artist and not a novice, but she also said that people with dementia actually produce work that sums up what they actually think, without trying too hard.

I have since learnt that many people with dementia take up art as a form of relaxation, and many prove to be excellent at it.

After this I do wonder how many other people with this illness start a new hobby and enjoy it as I did, (Apart from the Scream which went straight in the dust bin when I got home as it scared me to death).

Best Wishes

Ken"
Do we know what our dementia loved ones are thinking?,dcrowex,2024-05-04T13:39:08+0100,0,"I often wonder if there were any studies to determine what our loved ones are actually thinking. I sit with my friend, mostly non verbal, and she stares at the floor or the TV.  If I make a comment, she does not usually respond. She may look at me, but usually not.  So I wonder, does she know what I just said? When I make a comment about a character on TV, does she understand? When I ask her if she needs anything, does she understand what I am asking?  When I mention her tray of food in front of her will get cold and she needs to eat, she just looks at the tray.   I know she hears me but I do not think she can process what I am saying.  She may mumble something and if I ask here what she just said as I didn't hear her, she does not respond or gets irritated.  Anyone else wonder these things?  I read what I can about this but I never see this being addressed.
Best regards to all, Debbie"
Why I hate ‘The Long Goodbye’,WJG,2024-03-23T18:29:16+0000,0,"I loathe the new commercial for the Society ‘The Long Goodbye’. I think that it reinforces every negative stereotype about dementia, and does nothing whatsoever to help people such as myself living with brain disease. It dismays me that the Society has given it its backing.

Bruce Willis of ’Die Hard’ fame shares with me a diagnosis of degenerative brain disease. This commercial is all about telling people that those of us with such conditions not only die hard, but we die many times in advance of our own actual deaths. I prefer to ‘live well’, or as well as I can do. For this, I need help - and I need a change in attitude from the wider community. But this advertisement will only increase stigma, not lessen it.

The new drugs on the horizon will only work for people in the early stages of disease, so we need to convince people that there is value in seeking early diagnosis. No one watching this ad would want to do that.

I call on the Society to recognise that ’The Long Goodbye’ is a mistake, and to withdraw  it."
MBrooky,MBrooky,2024-05-13T19:08:18+0100,0,"Just joined, anybody there? MBrooky"
Can just be mad bad pride,MatthewB,2024-05-10T13:09:05+0100,0,If you wasn't so proud pride maybe couldn't be feeling so bad I guess I guess that's how it works it's hard one time you was there protector you was provide us you was always no what to do now now you are their problem is make you wish you could just be gone no more bother it's no more sad not too good on this talk no more maybe got it right
Travelling and going on holiday - any advice?,HarrietD,2024-04-23T16:51:41+0100,0,"Do you have any tips for other people with dementia about travelling and going on holiday?

Has there been something that's helped you plan what you'll be doing?

Something that's made the actual journey a better experience, or something that's helped make sure you can do things you enjoy while you're there?

Or perhaps something that’s helped you to settle back into things after you’ve returned home?

We’d love to share your advice with readers of our magazine, Dementia together - please email magazine@alzheimers.org.uk before 3 May.

Thanks everyone"
Nightmares,vas,2024-02-12T05:14:44+0000,0,"Does anybody have awful nightmares ? 
They are so bad I disturb my poor husbands sleep."
At a loss in knowing what help I need to assist me in my wife care,scout57,2024-04-25T09:49:23+0100,0,"Having no response from social service other than a call last November and have been caring for my wife for nearly two years, i deal with the constant challenges every day, my biggest issue is that I am on my own and can only leave the wife for short trips to the shops.. gone are the days out with friends. weekend away with my Scout Group, I can be woken at anytime of the night and spend ages trying to sort out a wet bed or telling her its the middle of the night and getting her back to bed (then i am up myself and cannot get back to sleep)."
Eating problems,USMSHARON,2024-03-31T22:24:07+0100,0,"Hi, I have had Alzheimer's since 2019.  Luckily I am still driving but my memory is getting worse.  I find my biggest problem though, is with food.  I don't really eat that much and there is very little I actually like.  I have gone off most of the things I used to like as they just don't taste the same any more.  I was just wondering if other people have this problem."
Medication and eating,cake4tea,2024-02-18T16:34:01+0000,0,"Hi
My mom has had Alzheimer's for roughly 10 years.  She also has an ileostomy pouch. Recently she has what seems to be regurgitating what seems to be either her pills or part of her snacks (only small amount) into her mug or cup of tea. She has also stopped finishing all her tea which is very unlike her.  She takes 5 different pills a day, levothyroxine, clopidogrel, amlodipine, artovastatin and donepezil. We wondered if this was a common problem at whatever stage she is at, as she sleeps a lot during the day but is bright otherwise. As it's only been happening the last few days we haven't spoken to her GP or memory Dr (they are different) yet."
"Newbie. Hi, my names is Campbell. I am 73 and have been living with dementia for about 18 months.",clamdaman,2024-04-21T01:46:00+0100,0,"Hi Everyone. I was diagnosed with dementia about 18 months ago, and had support from a wonderful lady from Ember.
I have learnt to cope with the memory part with lots of notes & reminders on my phone.
The parts I struggle with are :
1. The virtigo - This varies from day to day. On a good day it is almost non-existant, on a bad day I use my walking poles.
2. The emotional roller-coaster. There are days when I cry at the most rediculous things . . ."
Editing,Dunroamin,2024-04-17T18:26:46+0100,0,Is there anyway that admin can edit posts that do not have paragraphs?  There are often long and interesting posts with continuous prose.  Very difficult to read.
I am angry in the evenings,WilliamEvans,2024-03-30T22:19:24+0000,0,"I AM ANGRY IN THE EVENINGS

William Evans

March 2024​
So, this is about my Dementia, to be specific, Vascular Dementia. I was diagnosed almost a year ago in August of 2023. I have read and watched many things about dementia and found that almost everything is said or written by Drs. or caregivers. I am still skeptical of the diagnosis and I’m hoping the Dr. is wrong.

For all my life I have forgotten names and phone numbers. I have had trouble with remembering steps in tasks that I haven’t done for some time. Things like troubleshooting plumbing problems or structuring a paper I’m writing. But I have always worked it out after a few moments. After my diagnosis my wife and other family members are always watching me and are quick to correct me. This is hard for me to accept. Sometimes I’ll get irritated when questioned about somethings; particularly when I’ve thought through the process or problem and decided on how to proceed.

It's possible that some mental organizational processes are not as sharp as they once were, but I know where I am, what day it is, where I’m going and what I’ll do when I get there. I know what my wife and I did yesterday, the day before, last week and the week before. When I get frustrated and defend myself, I get “the look” and a “okay” which I know is a caregiver response of picking her battles with me.

Am I fading, or are people looking for me to fade and read normative behaviors as Dementia symptoms, which angers me and then I get a “there, there” or “okay”?

Oh yeah, I forgot, I turn 70 this year. Pun intended. I get tired of this by the evening and become angry.

Does anyone else feel this way? Is this part of the process?

William"
Tiredness,mikeb2,2023-09-17T16:15:58+0100,0,I feel so tired - even after some sleep it makes no difference- gets me down
My latest painting,Sheps,2024-03-28T18:55:45+0000,0,"I have just finished Singing for the brain art canvas which I’ve given as requested to my dementia group   We meet weekly and I love the group the singing and especially the socialising
Hope a few of you like it"
NHS blood test for Alzheimers bio markers,grahn,2024-02-14T15:12:06+0000,0,Read about an NHS blood test for Alzheimers bio markers trial. Wonder how one can find out or when a blood test might be available NHS or private?
Reaching for the stars while I still can ...........,Dunroamin,2024-03-20T09:45:54+0000,0,"MAny pursuits are now out of reach for me  (diagnosed with Alzheimers 5 years ago) but I can still swim and enjoy coldwater swimming year round. 

 Together with a trusty group of  5 women (all disabled in some form or other) we are pursuing a 100k swim challenge.  Currently up to 25k we are being interviewd by the BBC television later this morning.  

Feel so proud of my fellow swimmers and grateful for the support and encouragement of fellow swimmers and our amazing team of lifeguards."
You guys can heard of speech their therapy,MatthewB,2024-02-03T11:49:24+0000,0,I'm mast my doctor why other dementia ones can talk so better than me cause I'm I'm justice moderate not the bad more one he said is not by dimension but is is by the force first stroke is call phased phased a face see ya. Ok got to spell that one is aphasia. He say will medical no Medicare will approve a speech.   Therapy. You know that one? Can make me talk like more you guys? He says can help to do other things better too not just for is tocking but I'm can't know what he means this is Matt I'm hope you're good
Alzheimer’s,MEG48,2024-03-07T18:06:56+0000,0,"I was diagnosed June 2022, & my life began to change.  Prior to my diagnosis I had a home I loved in East Tennessee. My daughters saw changes in me that eventually led to living near a daughter in another state where I was diagnosed- -  (This move etc is a long story that may evolve if pertinent )
Finding this site is a light in my tunnel so I anticipate enjoying support & input from others as I travel a new path on this unexpected turn in my life’s’ journey -"
My daughter wrote this for us all to share - hope you like it.,dazk2002,2024-02-07T17:15:55+0000,0,"Wet lashes, hidden tears
Your eyes tell the story of unspoken fears
Fears of memories never to be made
Fears as loved ones blur and fade
But why fear when fear is only an illusion
It'll drive you into madness, delusion, and confusion
Move fear into the light
and we'll all be there in clear sight
forever, always, shining bright"
Sleep,Defiance,2024-02-05T12:37:04+0000,0,I have started having trouble going to sleep at night I lay awake for several hours and when I do drop off I am constantly waking up. I can drop off during the day no problem but not at night. I have alzheimers and vascular dementia can anyone tell me if this is normal as I always went sleep very quickly. Thank you.
Telling people you have dementia - any advice?,HarrietD,2024-02-06T16:04:52+0000,0,"Do you have any tips for other people with dementia on telling people about your diagnosis?

It could be about telling family and friends that you have dementia, or perhaps an employer?

Or about letting people in public places know you need more time or consideration, for example through a badge, helpcard or sunflower lanyard?

We’d love to share your advice with readers of our magazine, Dementia together - please email magazine@alzheimers.org.uk before 4 March.

Thanks everyone"
Disinhibition,David Joseph,2024-01-21T13:55:26+0000,0,"Dear Forum members,
I thought I knew about disinhibition, but sadly I do not. I have several questions that I can’t find answers to.
I’ve recently started swearing a lot inappropriately, talk a lot when I shouldn’t, talk to strangers on the bus or in shops, and feel I want to do these things at the time. For the last 78 years I never or rarely did so, but in the last year behaving like this has started and worsened!!! God help me.
What does this mean? Aside from memory problems, word finding when talking, not understanding, and unable to find objects round the house when my wife tells me where they are, I’ve been fine otherwise, and feeling better on donepysil. 
Can anyone advise me on what I don’t know? I didn’t expect this!
Should this be happening to me?

Thanks,

David Joseph"
Introduction,Morocco,2024-02-18T22:45:02+0000,0,"I am 59 (she/her) with a pathogenic C9orf72 mutation - feeling like I have no support from my family because I am still pretty functional. I find it soothing / calming to be in the online presence of others with dementia - I am struggling with several issues that seem to affect people with dementia ( my current stage is mild cognitive impairment - I still take care of my daily activities). I am tired and apathetic, and twitchy."
Sleep,Alis 17,2024-02-17T08:50:54+0000,0,"Hello,
I'm Alison early onset dementia. Can anyone help with sleep problems.i wake around 3am every night and it is driving me insane .thanks Alison"
I'm new to this group...,AYEHQUE,2024-01-05T23:09:29+0000,0,"Hello my name is Allison I am 54 yrs old and was diagnosed with early onset dementia around 3 years ago, I've since suffered mentally and physically with numerous health problems but I find the hardest thing to come to terms with is accepting that I'm losing my independence. Gradually I am relying more on others to help me carry out the simplest of tasks such as taking medication, shopping, keeping on top of household chores and remembering to make bill payments etc. I struggled to accept that this was real and I'm sure my loved ones also wondered was this self inflicted as I'd struggled with alcohol abuse in the past. I have only recently started to take this condition seriously and am beginning to accept it and the reality that the condition will get worse over time. I would be grateful for any information or advice you could provide me with on self help groups or activities I could enroll in my area, I live in TEDDINGTON SW LONDON and wouldn't mind having to travel a short distance by public transport, any advice will be gratefully received .
Thanks for your time
A"
what tests can show if your MCI is related to Alzheimers or not?,hopefu1,2024-02-12T13:10:20+0000,0,"I have just been diagnosed with MCI, but the neuropsychologist said she ""thought"" that it was not related to Alzheimers, but mainly a result of my heart bypass surgery in 2016.  But that's her ""guess"", it's not fact.  I have a neurologist appointment next month.  From my research I believe I'm seeing that a PET scan, or spinal fluids tests can show DEFINITIVELY whether my MCI is related to Alzheimers, or not.  What does anyone out there know about this?"
July 2020 diagnosis,Ruffy RJ,2024-01-31T17:20:01+0000,0,"I am seeing changes I'm my habits. I still exercise and walk my dog. However,I also stumble and walk weird somedays. 
I have a big support group in my family,but somtime you don't want to share all with them. So, they don't worry.
My spouse is the best thing God has given me . He is always here for me. And,he understands that it's not me , it's VASCULAR DIMENTIA."
Can be some way to right just one .?,MatthewB,2024-01-10T18:59:57+0000,0,If you want to ask one some things thing but is some more private can you just is talk to that one so is not everybody see. ? But not to be mean just maybe is some kind of embarrassment thing not bad
